{
  "$schema": "./pathway.schema.json",
  "id": "pv-ed-08",
  "title": "Client Success & PV Consulting Integration",
  "description": "Master the discipline of translating pharmacovigilance education into measurable client outcomes. From competency needs analysis and gap assessment through solution design, value delivery, and ROI measurement to comprehensive organizational transformation strategies.",
  "domain": "pharmacovigilance",
  "componentCount": 26,
  "estimatedDuration": "14 hours",
  "stages": [
    {
      "id": "pv-ed-08-01",
      "title": "PV Consulting Foundations",
      "description": "Learn the core models for pharmacovigilance consulting engagements: advisory, embedded, managed service, and hybrid delivery models. Identify key stakeholders, engagement lifecycles, and the relationship between education and consulting in the PV domain.",
      "bloomLevel": "Remember",
      "passingScore": 70,
      "estimatedDuration": "45 minutes",
      "activities": [
        {
          "id": "pv-ed-08-01-a01",
          "title": "Introduction to PV Consulting Models",
          "type": "reading",
          "estimatedDuration": "15 minutes"
        },
        {
          "id": "pv-ed-08-01-a02",
          "title": "Client Engagement Lifecycle Explorer",
          "type": "interactive",
          "estimatedDuration": "15 minutes"
        },
        {
          "id": "pv-ed-08-01-a03",
          "title": "PV Consulting Foundations Assessment",
          "type": "quiz",
          "estimatedDuration": "15 minutes",
          "quiz": {
            "questions": [
              {
                "id": "pv-ed-08-01-q01",
                "type": "multiple-choice",
                "question": "In a PV consulting engagement, what is the primary purpose of a needs analysis phase?",
                "options": [
                  "To identify gaps between current organizational PV capabilities and regulatory requirements",
                  "To sell the maximum number of training courses",
                  "To conduct a full GVP inspection simulation",
                  "To replace the client's existing QPPV"
                ],
                "correctAnswer": 0,
                "points": 2,
                "explanation": "Needs analysis systematically identifies the gap between an organization's current PV capabilities and what is required by regulations, industry best practices, or strategic objectives. This gap analysis drives the entire consulting engagement scope."
              },
              {
                "id": "pv-ed-08-01-q02",
                "type": "true-false",
                "question": "A managed PV service model typically involves the consulting firm taking operational responsibility for defined pharmacovigilance activities on behalf of the client.",
                "correctAnswer": true,
                "points": 1,
                "explanation": "In a managed service model, the consulting provider assumes operational responsibility for specific PV activities (e.g., case processing, aggregate reporting, signal management) under a service-level agreement, while the MAH retains overall regulatory accountability."
              },
              {
                "id": "pv-ed-08-01-q03",
                "type": "multiple-choice",
                "question": "Which stakeholder typically holds ultimate regulatory accountability for pharmacovigilance activities regardless of outsourcing arrangements?",
                "options": [
                  "The Marketing Authorization Holder (MAH)",
                  "The outsourced service provider",
                  "The contract research organization",
                  "The local safety officer at each affiliate"
                ],
                "correctAnswer": 0,
                "points": 2,
                "explanation": "Under both EU GVP and FDA regulations, the Marketing Authorization Holder retains ultimate regulatory responsibility for all PV activities, even when operations are outsourced. This is a fundamental principle that shapes all consulting engagement structures."
              }
            ]
          }
        }
      ]
    },
    {
      "id": "pv-ed-08-02",
      "title": "Competency Needs Analysis & Gap Assessment",
      "description": "Understand methodologies for assessing PV competency gaps: current-state vs. required-state analysis, regulatory requirement mapping, organizational maturity assessment using PV-specific maturity models, and strategic objective alignment to ensure education programs target the right deficiencies.",
      "bloomLevel": "Understand",
      "passingScore": 70,
      "estimatedDuration": "60 minutes",
      "activities": [
        {
          "id": "pv-ed-08-02-a01",
          "title": "Competency Gap Assessment Frameworks",
          "type": "reading",
          "estimatedDuration": "15 minutes"
        },
        {
          "id": "pv-ed-08-02-a02",
          "title": "Regulatory Requirement Mapping Exercise",
          "type": "interactive",
          "estimatedDuration": "15 minutes"
        },
        {
          "id": "pv-ed-08-02-a03",
          "title": "Organizational Maturity Assessment Case Study",
          "type": "case-study",
          "estimatedDuration": "15 minutes"
        },
        {
          "id": "pv-ed-08-02-a04",
          "title": "Needs Analysis Assessment",
          "type": "quiz",
          "estimatedDuration": "15 minutes",
          "quiz": {
            "questions": [
              {
                "id": "pv-ed-08-02-q01",
                "type": "multiple-choice",
                "question": "When conducting a PV competency gap analysis, what is the correct sequence of assessment steps?",
                "options": [
                  "Define required competencies from regulations/standards, assess current state, identify gaps, prioritize by risk",
                  "Assess current state, purchase training, define requirements afterward",
                  "Prioritize by budget, select courses, then define competencies",
                  "Conduct training first, then assess whether it addressed the right gaps"
                ],
                "correctAnswer": 0,
                "points": 2,
                "explanation": "Effective gap analysis follows a structured approach: first define the target state from regulatory requirements and best practices, then objectively assess current capabilities, identify the delta, and prioritize gaps based on regulatory risk and business impact."
              },
              {
                "id": "pv-ed-08-02-q02",
                "type": "multiple-select",
                "question": "Which data sources are appropriate for assessing current PV competency levels within an organization? Select all that apply.",
                "options": [
                  "Regulatory inspection findings and CAPA records",
                  "Individual performance assessments and training records",
                  "Case processing quality metrics (error rates, timeliness)",
                  "Competitor employee LinkedIn profiles"
                ],
                "correctAnswer": [0, 1, 2],
                "points": 3,
                "explanation": "Valid data sources include internal quality data (inspection findings, CAPAs), individual assessments (performance reviews, training history), and operational metrics (error rates, compliance timelines). Competitor employee profiles are not a valid internal competency data source."
              },
              {
                "id": "pv-ed-08-02-q03",
                "type": "true-false",
                "question": "GVP Module I requires that Marketing Authorization Holders ensure their personnel involved in PV activities are appropriately qualified and trained.",
                "correctAnswer": true,
                "points": 1,
                "explanation": "EMA GVP Module I (Pharmacovigilance systems and their quality systems) requires MAHs to ensure that all personnel involved in PV are suitably qualified, trained, and have defined roles and responsibilities. This creates the regulatory basis for competency-based training programs."
              }
            ]
          }
        }
      ]
    },
    {
      "id": "pv-ed-08-03",
      "title": "Solution Design & Program Customization",
      "description": "Apply solution design principles to create tailored PV education programs: map competency gaps to learning interventions, integrate technology-enabled delivery (LMS, simulation, e-learning), incorporate change management strategies, and design blended programs that combine education with on-the-job coaching.",
      "bloomLevel": "Apply",
      "passingScore": 75,
      "estimatedDuration": "55 minutes",
      "activities": [
        {
          "id": "pv-ed-08-03-a01",
          "title": "Designing Tailored PV Education Solutions",
          "type": "reading",
          "estimatedDuration": "15 minutes"
        },
        {
          "id": "pv-ed-08-03-a02",
          "title": "Technology-Enabled Learning Configuration",
          "type": "interactive",
          "estimatedDuration": "20 minutes"
        },
        {
          "id": "pv-ed-08-03-a03",
          "title": "Solution Design Assessment",
          "type": "quiz",
          "estimatedDuration": "20 minutes",
          "quiz": {
            "questions": [
              {
                "id": "pv-ed-08-03-q01",
                "type": "multiple-choice",
                "question": "When designing a PV education solution for a company that recently received inspection findings related to signal management, which approach is most effective?",
                "options": [
                  "Target signal management competencies specifically, using the inspection findings to define learning objectives and practical exercises",
                  "Provide a general PV overview course covering all topics equally",